{
  "$schema": "../schemas/task_state.schema.json",
  "task_id": "REPLACE_WITH_UUID",
  "created_at": "YYYY-MM-DDTHH:MM:SSZ",
  "updated_at": "YYYY-MM-DDTHH:MM:SSZ",
  "customer_id": "",
  "system": "",
  "task_type": "new_program",
  "status": "intake",
  "intake": null,
  "architect": null,
  "integration": null,
  "safety": null,
  "motion": null,
  "qa": null,
  "documentation": null,
  "conflicts": [],
  "retries": [],
  "handoffs": [],
  "artifacts": []
}
